,Filename,Original Transcription,Azure Transcription,Google Transcription,AWS Transcription,Azure_letter_accuracy,Google_letter_accuracy,AWS_letter_accuracy,Azure_word_accuracy,Google_word_accuracy,AWS_word_accuracy
0,marilynmonroe,"“I'm selfish, impatient and a little insecure. I make mistakes, I am out of control and at times hard to handle. But if you can't handle me at my worst, then you sure as hell don't deserve me at my best.”","“I'm selfish, important and a little insecure. I make mistakes, I am out of control and times hard to handle. But if you can't handle me at my worst, then you sure as hell don't deserve me at my best.”","I'm selfish, impatient and a little secure. I make mistakes, I am outta and at times hard to handle. But if you can't handle me at my worst, then you sure as ale don't deserve me at my best.","I'm selfish, impatient and a little insecure, umm I make mistakes I am out of control and at times hard to handle. ehh But if you can't handle me at my worst, then you sure as hell don't deserve me at my best",97.28395061728395,94.9238578680203,35.43689320388349,95.1219512195122,75.60975609756098,90.2439024390244
1,drseus,You know you're in love when you can't fall asleep because reality is finally better than your dreams.,You know you are in love when you can not fall asleep because reality is finally better than your dreams.,You know you're in love when you can't fell asleep because reality is finally better than your dreams.,You know you're in love when you can't fall asleep cuz the reality is finally better than your dreams,96.61835748792271,99.01960784313727,95.56650246305419,77.77777777777779,94.44444444444444,94.44444444444444
2,jkrowling,"If you want to know what a man's like, take a good look at how he treats his inferiors, not his equals.","If you want to know what a man is like, take a deep look at how he treats his inferiors, not his equals.",If you want to know what a mans like take a good look at how he treats his inferiors not his equals,"If you want to know what a man's like, take a good look at how he treats his inferiors, not his equals.",95.65217391304348,98.01980198019803,100.0,86.36363636363636,100.0,100.0
3,robsiltanen,"Here's to the crazy ones. The misfits. The rebels. The troublemakers. The round pegs in the square holes. The ones who see things differently. They're not fond of rules. And they have no respect for the status quo. You can quote them, disagree with them, glorify or vilify them. About the only thing you can't do is ignore them. Because they change things. They push the human race forward. And while some may see them as the crazy ones, we see genius. Because the people who are crazy enough to think they can change the world, are the ones who do.","Here's to the crazy ones. The misfits. The rebels. The troublemakers. The round pegs in the square holes. The ones who see things differently. They're not found of rules. And they have no respect for the status duo. You can quote them, disagree with them, glorify or vilify them. About the only thing you can't do is ignore them. Because they change things. They push the human race forward. And some may see them as the crazy ones, we see genius. Because the people who are crazy enough to think they can change the world, are the ones who do","Here's to the crazy ones. The misfits. The rebels. The trouble makers. The round pegs in the square whole. The ones who see things differently. They're not fond of rules. And they have no respect for the status quo. You can quote them, disagree with them, glorify or vilify them. About the only thing you can't do is ignore them. Because they change things. They push the human race forward. And while some may see them as the crazy ones, we see genius. Because the people who are crazy enough to think they can change the world, are the ones who do.","Here's to the crazy ones. The misfits. The rebels. The troublemakers. The round pegs in the square holes. The ones who see things differently. They're not fond of rules. And they have no respect for the status quo. You can quote them, disagree with them, glorify or vilify them. About the only thing you can't do is ignore them. Because they change things. They push the human race forward. And while some may see them as the crazy ones, we see genius. Because the people who are crazy enough to think they can change the world, are the ones who do.",99.08424908424908,98.99909008189263,100.0,97.02970297029702,97.02970297029702,100.0
4,MahatmaGandhi,Live as if you were to die tomorrow. Learn as if you were to live forever.,Live as if you were to dye tomorrow. Learn as if you were to live forever.,Live as if you were to die tomorrow. Learn as if you were to live forever.,Live as if you are to die tomorrow. lean as if you are to live forever.,98.64864864864865,100.0,93.79310344827586,93.75,100.0,81.25
